Serial No.,College Name,Rating,Pros,Cons
389,Dayananda Sagar University - [DSU],3.8,The campus is great and you can spend ample amount of time with you friends. | Faculty members are good they will encourage us in every aspect and motivate us they will give valuable information to be a differintiator | The campus is great and you can spend ample amount of time with you friends.,The schedule of a semester is horrible as it is shrunk down to 4 months. | Manegement is very poor they never take their exams according to the calendar
390,C. U. Shah University,3.4,no pros found,no cons found
391,Techno Main Salt Lake,3.9,Campus life is awesome faculty is awesome and placement is also awesome | We can come and go out of college whenever we want and during classess as well and the campus is also very good | Campus life is awesome faculty is awesome and placement is also awesome,"Some seniors are so bad ,they always try to get benefit. | I being and outsider unable to understand bengali, they hate this that non bengali person is here."
392,P.P. Savani University,4.5,The social behaviour of each and everyone at campus and the environment they provide are at it's best. | I like that college provide us visits and we all enjoying it. | The social behaviour of each and everyone at campus and the environment they provide are at it's best.,Need 45-60 min to reach university and lot's of traffic at highway . | During rain there is no space to sit outside the campus .
393,VIT University - [VIT- AP],4.0,Canteen : canteen is a place where you can seat with your homies and chit chat and have a delicious dishes over there | The availability of books and generals through online portal has impressed me a lot. | Canteen : canteen is a place where you can seat with your homies and chit chat and have a delicious dishes over there,In canteen food is very bad management want to change the canteen | I paid 100rs for forgetting ID card on an exam and the process is also annoying.
394,Usha Martin University - [UMU],3.9,The cricket ground of our university is the best part of our university | The sports ground of the college is very good and every now and then state matches are played | The cricket ground of our university is the best part of our university,Managment is the worst thing here you have to rush to do the paperwork | I don't like the meal of hostel becoz it is too worst...
395,Sangai International University - [SIU],4.1,no pros found,no cons found
396,Pranveer Singh Institute of Technology - [PSIT],4.1,The library facility : The library facility is awesome as they also provide access to renowned online library. | The best thing of Pranveer Singh institute of technology is it's infrastructure and facilities. | The library facility : The library facility is awesome as they also provide access to renowned online library.,I hate some faculty members which are very rude to students. | I do not like the librarian as they are very rude and strict
397,Rama University,3.5,"This course is one of the best courses. The entire course structure is based on research. However, in my college, there are no research facilities. | Students can either stay in a hostel or manage their own rooms outside the campus. | This course is one of the best courses. The entire course structure is based on research. However, in my college, there are no research facilities.","Thats not good scholarship. It is only available for OBC and SC students, while government general category students cannot avail of this scholarship. Additionally, only 30% of students are able to secure a job through campus placements. | I kept requesting a projector for the classroom since semester one, but there was no response"
398,Birla Institute of Technology - [BIT],3.6,"I have a great interest in computers and software, so I want to pursue a career in that field exclusively. | The internship has been one of the best things to look at and it is good beyond expectations. | I have a great interest in computers and software, so I want to pursue a career in that field exclusively.","The course curriculum in terms of learning is absolutely the worst of all, as we only had to score good marks to pass. | Colleges boast about other facilities, such as wifi, etc., which are not provided to students."
399,Institute of Advanced Studies in Education - [IASE University],4.2,FACULTY AND STAFF NATURE AND BEHAVIOUR....,Teacher are always very serious about the study
400,Jayoti Vidyapeeth Women's University - [JVWU],4.0,There security is very good. The campus is familiar. | Infrastructure is good. University provide good environment | The campus of college is quite big and greenery,This university is phone prohibited. This is not good | So many problems faces the students because of phone
401,Anurag College of Engineering - [ACE],3.8,About college greenary is very best that was too good to sit in the garden after sports like cricket practice and volleyball playing and one type of some Jim materials are available to do some exercises and over all about sport that was very nice ... | I like my faculty members they are teached very well and I was soo happy to join in my college and I most liked that placements in my college is very good and that are very I like most and ever best college I think in my way .that was good my college | About college greenary is very best that was too good to sit in the garden after sports like cricket practice and volleyball playing and one type of some Jim materials are available to do some exercises and over all about sport that was very nice ...,That was too long to go college and in college lift only faculty will go but students doesn't use that lift I don't know why lifts are not use the students that was too bad in my college and I hate it to having a worst decisions about faculty member | I dislike class room was not good and washroom was also not good
402,Agni College of Technology,3.7,Transportation is best in the college as it connects to all places in surrounding areas. | Transportation is the best in college as it connects to all place in surrounding area. | Transportation is best in the college as it connects to all places in surrounding areas.,Wi-Fi connections are too weak and can't get network in some of the places in the campus | Hostel rooms are very bad and bathroom is much more worse
403,Bengal College of Engineering and Technology - [BCET],3.6,The seniors are very good and helpful.thee is very good campus | The connectivity of the college with the city is very good | The seniors are very good and helpful.thee is very good campus,"Gym faculty was not good it was very small and less items | Don't like the work which was done by office member, which was little bit slow."
404,Chandigarh Engineering College - [CEC] Landran,4.0,College program it was great becose there a lot of dancing party. | Campus is very beautiful and in campus their are many activities to do | College program it was great becose there a lot of dancing party.,"While the teachers knew their stuff, sometimes there were issues in communication that made it a bit tricky to fully grasp complex subjects. | Students always complain about it but no action is made ."
405,Delhi Technical Campus - [DTC],4.2,infrastructure | faculty,placement
406,Dr. B.C. Roy Engineering College - [BCREC],4.0,There's also a Loknath Temple beside the field which is perfect for Hindu bhakts like me | They provide us two canteen for feeding a every bite of delicious foods. | There's also a Loknath Temple beside the field which is perfect for Hindu bhakts like me,"The things that I dislike about the fee structure as well as the management here the management are very bad | Canteen food is very bad in our clg, and can costly"
407,Erode Sengunthar Engineering College,3.6,"Our course syllabus was recently updated. There is not much industrial exposure, maybe 2 or 3. The faculties are really good and they do their job well, caring for each students goal. Their way of teaching is awesome, making it easy for students to understand. | It was an overall very good experience for me. There is no internship available within the college. | Our course syllabus was recently updated. There is not much industrial exposure, maybe 2 or 3. The faculties are really good and they do their job well, caring for each students goal. Their way of teaching is awesome, making it easy for students to understand.","Overall, I can say that the placement and job opportunities in our college have been poor throughout my career. | Very poor hostel facilities; its a shared room for four people. I have never tasted hostel food as bad as this in my life. It is the worst, yet they charge a high price for both the food and rent."
408,Geethanjali College of Engineering and Technology - [GCET] Keesara,4.1,Our infrastructure is real good and the greenary is real good | Placement are very good over 1500 students are placed this year. | Our infrastructure is real good and the greenary is real good,"Faculty , not good at teaching in my point of view | I dislike about the college is the travelling problem I used to travel everyday around 22 kilo meters"
409,IILM University,3.9,Scholars cafe is the best place to hang out with friends | The university's infrastured is very good and the unversity is flushed with greenery. | Scholars cafe is the best place to hang out with friends,Students do smoking and drink alcohol in the hostels room that's very disappointing. | Some faculty have not good skill of teaching they keep class boring.
410,Inderprastha Engineering College - [IPEC],3.8,Placement of CS and it it is very good in our college from 7 semester companies are came and it will continue till 8th semester end | Placement of CS and it is very good in our college from 7th semester companies are came and it will continue till 8 semester end | Placement of CS and it it is very good in our college from 7 semester companies are came and it will continue till 8th semester end,And my director visited properly during running the class this is very bad | The worst part is the location of the college it is it located near a sewage
411,Kanpur Institute of Technology - [KIT],3.6,The environment is very good so that you will not have any problem in meeting anyone. | You can make very good friends and good relationship with some faculty. | The environment is very good so that you will not have any problem in meeting anyone.,"There is no scope for practical learning in that college.even hardly any learning can sustain in that filthy environment. | Canteen foods are not good, no one like the canteen food"
412,Kashi Institute of Technology - [KIT],3.9,"The exams were successfully completed on time, and thanks to the best teachers and excellent studies, we had no difficulty in passing them. | I have done an internship from LYRICLIOUS, and this is the best platform for an internship. | The exams were successfully completed on time, and thanks to the best teachers and excellent studies, we had no difficulty in passing them.","In the Mechanical Engineering department, there were very few chances of placement. However, our department made an effort to place as many students as possible"
413,Lakshmi Narain College of Technology - [LNCT],3.3,I likes the classrooms and my friends during my courses. | College provide beautiful and peaceful environment for better concentration. | College have very beautiful infrastructure and buildings .,Their faculty and staff specially mba faculty is not friendly and supporting.
414,Meenakshi Sundararajan Engineering College - [MSEC],3.9,"The first year of my college was good, because of the teachers but the teacher are so biased if they like you they will do anything for you if they don't like they will torture. Since my class teacher and all the teachers liked me they were too good | If you are going to study hard and going to get high marks means this college is good because it will give you school vibes | College campus and infrastructure is really good and maintained well","Actually everything, very bad environment strict environment it is worst than any school | No functions no sports no annual day , no OD and nothing"
415,Nandha Engineering College - [NEC],3.6,"Exams were conducted in a good manner and the questions they asked were all from our prepared topics. | Surrounding the college, there are more companies that offer industrial visits once a year in your course curriculum, and they support the students for internships in the industries. | Exams were conducted in a good manner and the questions they asked were all from our prepared topics.","Water shortage is a major problem here, and at peak time (8:30 am), the bathrooms are too crowded that we have to wait in a long queue. Its the worst part"
416,Pragati Engineering College,3.8,The campus is spacious and provides an excellent environment for learning. | Pragati engineering College was one of the best college in my career. | The campus is spacious and provides an excellent environment for learning.,I don't like the food in canteen because it is so bad | I dislike the food in canteen because it is so bad
417,Prathyusha Engineering College - [PEC],4.0,"Every week, there are four lab periods. The lab equipment pieces are excellent. The course structure is very nice. | There was no concept of internship in this college, but education-wise, the college is really good. | Every week, there are four lab periods. The lab equipment pieces are excellent. The course structure is very nice.",It was hard to search for and get an internship in Chennai. | The only company that conducted a training program for a fee in the college and recruited only those who attended the program was TVS-Harita
418,RCC Institute of Information Technology - [RCCIIT],3.8,"If you have eager to explore engineering, then this is the one of the best place. | The faculties are so helpful and their teaching style is very impressive. | If you have eager to explore engineering, then this is the one of the best place.",College doesn't have any hostel.so for out of the district student it is very bad | The water filters are not repaired so the quality of the water is so much annoying.
419,RMD Engineering College,4.0,"The course curriculum is prepared based on industry needs, and my course is best for me because its amazing. | The internship has been happening based on projects, and good opportunities will be given to every student. | The course curriculum is prepared based on industry needs, and my course is best for me because its amazing.","Very few companies. Only I got a job by off-campus. Only they are providing useless training and placement activities, which are not helpful for interviews. | They are not getting many companies for placement. I hate this college in this statement."
420,Sambhram Institute of Technology - [SAIT],3.6,"Among all branches, our CS branch is the best, and the faculties in our department are very good. | Yes, if you have any good lecturers in contact, you can seize some opportunities. | Among all branches, our CS branch is the best, and the faculties in our department are very good.","The circular followed by Vesehvariya Technology University or VTU. The course is simple, but the 2015 CBCS scheme is very bad. In the scheme, students have suffered losses due to some University guidelines because the grading system is the worst. | This made all the students feel very bad, and all the companies demanded 3k-10k for the internship."
421,Sphoorthy Engineering College - [SPHN],3.9,Principle was strict and gave us a good security and every week the classes were held for behaviour changes. | College atmosphere is good and we have a lot of greenary in our college | Principle was strict and gave us a good security and every week the classes were held for behaviour changes.,Treating us like a small growing up children won't let us move here and there in corridor | The faculty is not good enough to explain the coding subject's not all but some of the faculty.
422,Sri Eshwar College of Engineering - [SECE],3.9,The course was designed by the best faculty who had a lot of experience in the industry and were constantly conducting research to improve the quality of education in the college. | Our college is the best at signing up with many companies for Industry Powered Laboratories. | The course was designed by the best faculty who had a lot of experience in the industry and were constantly conducting research to improve the quality of education in the college.,"Campus size is very small , gets so used and boring . | No IV (Industrial Visit ) for freshmen ."
423,SJB Institute of Technology - [SJBIT],3.7,"In the civil branch, the course curriculum is excellent, and the exam pattern follows the rules of the government-prescribed way of exam structure. | These companies may offer college students the opportunity to work for them if they see that the students are performing well during their internship. The topmost companies include Wipro, Infosys, Tech Mahindra, TCS, Dell, HP, L&T, and many others that visit the college. | In the civil branch, the course curriculum is excellent, and the exam pattern follows the rules of the government-prescribed way of exam structure.","Moreover, in colleges and universities, students are made to memorize the subject and take exams. Very little priority is given to practical approach. | The hostel food is not good. It is the worst food I have ever seen. Additionally, the accommodation fees and charges are very high. The quality of the food is even worse than the worst. Therefore, I will give this place one star"
424,The Oxford College of Engineering,3.2,"The course was excellent. It was specifically designed to suit the exam and provide knowledgeable facts. The course also offered excellent placements. I was referred to this course and branch by a senior of mine. | Yes, they do give opportunities for both off-campus and on-campus. Im so happy that I successfully completed my internship with some doubts cleared by my teachers. | The course was excellent. It was specifically designed to suit the exam and provide knowledgeable facts. The course also offered excellent placements. I was referred to this course and branch by a senior of mine.","Its not very focused on practical learning as there is less and costly lab equipment. | Worst college - no internships are provided here. Search for one and do it. That is the slogan you have to follow. If you have no experience, do not join even one internship in any company. The amount is not important; it depends on the internship we do."
425,Bhilai Institute of Technology - [BITR],3.6,"The hostel facility are great bcoz each room has different toilet not attached and have wifi enable campus | Infrastructure is also good we have excellent great sitting mess facilities for dayboders and hostalites as well | Badminton court , the football ground and tennis court",I don't liked the mess food as same as other hostel also | Our college don't do cultural program or fest less tha 3 to 4 program are there in a year
426,Jaipur Engineering College - [JEC],4.0,"College placement, playground, cafeteria class room and the best part of the college is the mechanical Engineering work Shop. | In my opinion sports facilities of this college is best . | College placement, playground, cafeteria class room and the best part of the college is the mechanical Engineering work Shop.",The canteen is not very good of this college and it's timing is also very less | Non- veg is not allowed in the hostel and not provided in the mess.
427,Vidyavardhaka College of Engineering - [VVCE],4.1,"The course curriculum is a bit hectic, but my college has undertaken a good step to ensure that they deliver the best they can. | The internship is really great here. The benefits of the internship here include receiving certification from Youth4work after achieving the assigned goals. | The course curriculum is a bit hectic, but my college has undertaken a good step to ensure that they deliver the best they can.","When I joined college, it was under VTU. VTU exams might not be that difficult, but the marks you see on your report card dont agree. The evaluation in the VTU system is very poor. | Internship opportunities in our college are scarce. Only a few companies visit for other branches, and some companies offer a meager amount of pay, while others do not pay at all."
428,Vidya Jyothi Institute of Technology - [VJIT],4.0,The infrastructure of the college is very beautiful with all the greenary surrounded by it. | Environment in the college that is the vibe is very impressive | The infrastructure of the college is very beautiful with all the greenary surrounded by it.,Sometimes it's difficult to get jobs but our college tpo sir supports alot | The reputed companies should be brought for the placements rather than the small start up companies
429,GITAM,4.0,If you use all the sources given by the university you will be at your best placement. | There is beach just a 5 min walk away which is very beautiful | If you use all the sources given by the university you will be at your best placement.,"Lack of hospitality with the management, they are very rude with the students. | In some blocks lifts won't be available,it difficult to shift classes and during summer you can't imagine the wet"
430,Modern Vidya Niketan - [MVN University],3.0,"Infrastructure is good , transportation facilities available | Respect other college that is I appreciated is the faculty which is good and under fields that need to be improvement is admission section | Teacher and faculty members are good and support Asar",Doesn't organize fest and cultural programs
431,Arni University,4.1,no pros found,no cons found
432,Bahra University - [BU],3.8,Here I really like the way the teachers teach as I have known in alot of collegea that the teachers don't takethepain but it's nothing like that in our college it's reallygood . | I also love the location how peaceful the environment is for studies. | Ya our college is also doing good in all the things bu some things they are trying hard to make child comfortable I'm agree with all the things they are doing,Discrimination between girls and boys . More freedom isgiven to them . | Fest and parties should be conducted more .
433,Amrita Vishwa Vidyapeetham Bengaluru Campus,4.0,"Research Scope, We Have Very Good Labs And Facilities for Research | We gettin to good companies in placements cuz of cir department | Research Scope, We Have Very Good Labs And Facilities for Research",Food provided in campus Mess is worst when compared to other deemed universities | Food is not good in hostel and daily the put sambar
434,Sangam University - [SU],4.2,"The course curriculum is based on the RTU syllabus, and they also teach expert video lectures from NPTEL. The faculty is the best. | Also, there are good chances of going abroad for research projects, which are 100% financed by the professor. | The course curriculum is based on the RTU syllabus, and they also teach expert video lectures from NPTEL. The faculty is the best.","Instead of placement drives, students in the 7th and 8th semesters are given exemption from attendance so that they can go for interviews. | There was no kind of student loan university provided when I was in college"
435,Periyar Maniammai Institute of Science and Technology - [PMIST],4.0,I like my environmental of the University which is very eco friendly. | Our facultya are very friendly with the students and they are ready to help whenever you ask any help. | Great classrooms with natural lighting and ventilation.Separated Classrooms and Studio spaces for better learning.,They don't offer liberality to students which leads to some mental pressures. | We want more evens to participate and showcase or talents.
436,Shri Venkateshwara University - [SVU],4.3,"The college provides sufficient knowledge in the form of industrial visits, guest lectures from the best people in the field, and good opportunities. | Placements are excellent if you have scored well in your studies. There are a lot of job opportunities at the university. | The college provides sufficient knowledge in the form of industrial visits, guest lectures from the best people in the field, and good opportunities.","there is not any thing which I disliked, but yes their fees is bit expensive, not affordable for everyone."
437,St Joseph College of Engineering,4.2,Our curriculum was structured in a way that exposed us more to theoretical classes rather than industrial exposure. | The college will surely insist that students opt for an internship every semester based on their own interest. | Our curriculum was structured in a way that exposed us more to theoretical classes rather than industrial exposure.,"The industrial exposure is very bad. They will bring us to some project centers and tell us, This is your industrial visit. This happens due to some faculty thinking that their decision is final and no one can question them. | A very small number of sports are available for the entire student body, apart from the college sports players, and the college is generally strict."
438,Lakshmi Narain College of Technology - [LNCT],3.8,"The college upholds the academics standards,the teaches to student ratio is excellent | Hostel warden , hostel facilities, hostel friends are the best a person can get. | The college upholds the academics standards,the teaches to student ratio is excellent",I also hate college timing because of that students didn't get any time for self study | The worst thing in college is they told you time table of mid semester exam is one or two day before
