Serial No.,College Name,Rating,Pros,Cons
1,BITS Pilani (Pilani Campus),4.4,"Faculties are very experienced, and talking about infrastructure so it's built on around 360 acres land and is very beautiful. | Sports culture is very good on campus along with two fests. | Faculties are very experienced, and talking about infrastructure so it's built on around 360 acres land and is very beautiful.",The biology in the second semester is horrible to study and remember | I really disliked that it is really difficult to get to campus as transport is very difficult.
2,Institute of Chemical Technology - [ICT],4.3,"That you can have the best technical knowledge, which helps in your technical interview. | Stipend is not mentioned, but experience can be gained through any internship if done with great effort and understanding. | That you can have the best technical knowledge, which helps in your technical interview.",The gender ratio is neither good nor bad. There are numerous extracurricular activities organized every academic year
3,Vellore Institute of Technology - [VIT University],4.1,I like the coding culture that is in my college is excellent. | Placement oppurtunity given by vit is very good where every student is guarenteed to get atleast one job in hand when leaving the campus. | University provides complete freedom for both boys and girls,The worst thing are the PDA guards a guy and girl can't walk sit together according to the college too conservative. | Worst part is we have to change class for every for every period like 45minutes
4,Thapar Institute of Engineering and Technology - [Thapar University],3.8,The college also provides sports facilities and students are very happy to be here | Socieites and clubs are one of the best part of any college. | The college also provides sports facilities and students are very happy to be here,"I hate 75 attendance criteria , this is very bad thing | There are lot of dogs roaming in the university which is annoying"
5,Indian Institute of Space Science and Technology - [IIST],4.2,"Avionics is in great demand in many IT and CS sectors, and I have a huge interest in avionics, which is why I opted for this branch. | The internship program of the college is very good, as the majority of my batch mates participated in an internship at ISRO. | Avionics is in great demand in many IT and CS sectors, and I have a huge interest in avionics, which is why I opted for this branch.","I did not need any assistance as every semester I received an assistantship from DoS. Therefore, I have not had to pay a single penny to IIST till now"
6,Birla Institute of Technology - [BIT Mesra],3.7,The library is quite impressive and contains lots of journals and books. | Weather of this place is the best one can think of | The library is quite impressive and contains lots of journals and books.,Management is very bad and always blames students for any problems. | Administration is very bad as it do not listens to anyone.
7,Amity University,4.0,The faculty is like a family and helps to solve the problems which are faced by the student so that they can give there best in the exam. | I like college faculty because excellent bond between students and teachers. | The faculty is like a family and helps to solve the problems which are faced by the student so that they can give there best in the exam.,They were not flexible and sometimes it used to be very difficult to take some time off of work and then take the exam | It gets very difficult to go from one department to another.
8,SRM Engineering College,3.7,This college is really good and i liked very much. best way yo enjoy college life,Nothing to be honest may be they can reduce their fees little bit
9,SSN College of Engineering - [SSNCE],4.1,"I have chosen this course at this college because I can pursue both the core side and the IT side based on my interest, and SSN is one of the best colleges that offers the highest placements in Chennai. | The college will provide you with funds if your project is innovative, and we have many mentors to guide the project and conduct research in the field of our choice. | I have chosen this course at this college because I can pursue both the core side and the IT side based on my interest, and SSN is one of the best colleges that offers the highest placements in Chennai.","There was no internship offered at that time, so we voluntarily went to a few companies and did small works, but didnt get any stipend for that. | If there is a positive response, I have to give it to the entire staff and labs. However, when it comes to negative feedback, the college management was very poor and the worst when it came to collecting fees and granting condonation."
10,SASTRA University,3.8,"And clubs and sports are very nice .and tech clubs also | Dress code is good as well ..for girls dupatta is must...noo jeans, t shirts, crop tops are allowed | And clubs and sports are very nice .and tech clubs also",The timing are not good there are noo holidays in this campus. | The syllabus are little bit difficult to study but however it is manageable
11,Manipal Institute of Technology - [MIT],4.3,"The campus life at MIT Manipal is the best you'll ever get, you'll never want to go backto | Food, Accomodation all are some of the best you could find in a university | The campus life at MIT Manipal is the best you'll ever get, you'll never want to go backto","Hence it gets very annoying going to classes in the scorching heat and humidity | There are 3 languages i.e., Tulu, Konkani and Kannada which is very difficult to identify the native people speak"
12,P.S.G College of Technology - [PSGCT],4.4,"It has been the best learning platform where they help us discover our interests and excel in those fields. | The college has its very own industry situated inside the college itself. Yes, they provide internships to students within the college. The stipend varies based on the kind of internship and the company from which they are receiving it. | It has been the best learning platform where they help us discover our interests and excel in those fields.","Scholarship/loan offered by the college. If you take a loan outside, then you can get the required signatures from the college authority. | I still remember how girls were called to the wardens room to be warned if they were seen walking to the hostel and talking to a boy"
13,Sathyabama Institute of Science and Technology,3.9,The course CSE here is one of the excellent here in this university. | The fest they conduct once in a year and it will the best | The course CSE here is one of the excellent here in this university.,FOR NORTH INDIANS THE FOOD IS VERY BAD WE CAN'T EAT THERE | I didnot like the bus transport as it is dirty inside the bus
14,Kalinga Institute of Industrial Technology - [KIIT],4.2,"College have a aircraft for the students of aerospace, the best part was the lab has one MIG-27 engine | Class rooms , lab facilities, and sports facilities provided by the kiiy university is excellent | Campus life is good . Kiit has a very big and vibrant campus anyone would like , there are numerous clubs , societies , events allowing students to explore their interests",The food quality was really bad and no attention was pain to it | ROI is very less unaffordable college life course curriculum is worst
15,Siksha 'O' Anusandhan University - [SOA],4.3,"The placements from this college are the best part of this college. | Here campus facilities, library facilities, transport facilities, food facilities are very good. | The placements from this college are the best part of this college.","Placement is worst and they are taking addmission like a beach 5K students in cse itself | Drainage system are very bad, as compared to another college, that means water become overflow during rainy season"
16,K L University - [KLU],4.2,"The campus life in Kl university is best, the envirnoment around creates energy. | Environment where KL, Guntur located is very beautiful, its just iconic | The campus life in Kl university is best, the envirnoment around creates energy.",Rules in my collage I hate them I dont want all those rules | The registration process for this semester is very tough and uncomfortable.
17,Kalasalingam Academy of Research and Education,3.5,Education is very good like we will be given projects every sem | And one more the classes are very good and neat the campus. | Education is very good like we will be given projects every sem,Food that provided in hostels will be sometimes very bad rhat we cant eat. | I don't like the foods provided in college canteen the food are not good for the money
18,R V College of Engineering - [RVCE],4.0,The placements coordinators look after each student and see through that each student get placed with best package . | The college's commitment to providing excellent placement opportunities was another standout aspect. | The placements coordinators look after each student and see through that each student get placed with best package .,"The management here is really bad, they cant plan things accordingly | I fought false allegations of cheating and that went on for a while, because of a lab assistant."
19,Ramaiah Institute of Technology - [RIT],4.0,Wifi is provided which is very good and cleaners are appointed | I like the college because campus is beautiful and also teaching staff is good because they will teach brilliantly | Wifi is provided which is very good and cleaners are appointed,The hostel mess is really very bad and should be improved | Teachers and professors are not good in explaining concepts to students
20,International Institute of Information Technology - [IIIT-B],4.2,"Professors are really talented and knowledgeble. They are very cooperative and helpful as well. | Peer group is very awesome, since everyone holds similar range of ranks. | The faculty was good , well trained and good mentor .","I think the campus size is little small, although it is very optimised so this could be a little disadadvantageous sometimes. | In the first and second year worrkload is high, although those works are very rewarding eventually."
21,BMS College of Engineering - [BMSCE],4.1,Best infrastructure and excellent class room with air conditioner and BMS has the best facilities and BMS has the top placements and BMS cames under top 5 college in Karnataka. | Infrastructure is good and the instruments are great and in working condition. | Best infrastructure and excellent class room with air conditioner and BMS has the best facilities and BMS has the top placements and BMS cames under top 5 college in Karnataka.,"The hostel fees is very expensive although the tuition fee is way less compared | Management, it is not good at all, like they make their ways out leaving students to suffer."
22,Karunya Institute of Technology and Sciences - [Karunya Deemed University],4.1,Hostel food and play ground and climate are very liked by the students. | Playground its very nice place to pass times and good climate | Hostel food and play ground and climate are very liked by the students.,Placement given by the university is average and there is no outing for the students . | Travelling from college to city is very long atleast one hour.
23,Kumaraguru College of Technology - [KCT],4.2,The way of teaching is very good and also teachers shine our skills. | I liked infrastructure of college because it should be very comfortable zone for students | The way of teaching is very good and also teachers shine our skills.,Few Departments classes are quite ugly and can be maintained in future. | Management process will be quite complicated and it will take lots of effort to get the simple things done.
24,Punjab Engineering College University of Technology - [PEC],4.0,The number of clubs we get here is awesome and we can improve or develop ourselves in any field we want | The best thing is the city it is one of the best city and has everything that we need | The number of clubs we get here is awesome and we can improve or develop ourselves in any field we want,Faculty can be annoying to deal with given the government nature of the college. | Mess facility is very bad.. Food served here is very unhealthy.
25,Jaypee Institute of Information Technology University - [JIIT],4.0,The faculty is the best thing in Jaypee institute of Information Technology. | Societies of the college is the best thing according to me | The faculty is the best thing in Jaypee institute of Information Technology.,"There is uniform in college, which gets very boring to wear. | There are no stray dogs in the campus, which is really disappointing"
26,Indian Institute of Information Technology - [IIIT],4.3,Coding culture of this college is very good which help students to improve thier skills | Placements are very good so it is the best thing that i liked. | Coding culture of this college is very good which help students to improve thier skills,"The number of shops are very less in the college campus, which is very bad. | The formation of Ethics Committee which restricts the freedom of college students and make campus life suffocating."
27,Dayalbagh Educational Institute Faculty of Engineering,4.1,College has excellent faculty members all are phd and M.tech Qualified | The campus life in this college is very good all around there is greenery | College has excellent faculty members all are phd and M.tech Qualified,Poor infrastructure lack of classrooms students have to sit on ground to study. | College is very old as a real spent of the college also get fall down started
28,Mepco Schlenk Engineering College,4.1,"I really enjoy the way they are teaching, and I think the curriculum is truly amazing. The academic standards are also very high. | In our college, many staff members can work with us to help us secure internships for placement. | I really enjoy the way they are teaching, and I think the curriculum is truly amazing. The academic standards are also very high.","A lot of stupidity happening in the name of college reputation can be seen. | In 2014, we had only three companies offering internships, and the average stipend was $10K."
29,Sri Venkateswara University College of Engineering,3.9,Hostel provided by the university is very good and menu is excellent | FOOD ALSO VERY GOOD AND QUALITY AND QUANTITY ALSO VERY GOOD. | Hostel provided by the university is very good and menu is excellent,"The wifi facility is very poor in the hostel and it has to be improved | Teachers did not respond In labs ,lab equipment also not nice"
30,Dhirubhai Ambani Institute of Information and Communication Technology - [DA-IICT],4.3,I also like infrastructure of this college which is very good. | I like the campus facilities and hostel they are so good | I also like infrastructure of this college which is very good.,The teching policy is quite hard and exams are also hard | Holidays are given less and summer vacation and winter vacation also
31,Bharati Vidyapeeth Deemed University Pune,3.8,The canteen food is awesome i loved to eat momos from the canteen a lot. | Good environment like we all know pune have best weather anytime | The canteen food is awesome i loved to eat momos from the canteen a lot.,I dislike here canteen food they makes not good as we want | College timing is not good as students can not manage time for other activities and other courses
32,Hindustan Institute of Technology and Science - [HITS],3.3,"The htc people was great, you just can relay on them | Ambience and the staff who are very kind and knowlegdable . | The htc people was great, you just can relay on them",I heard college hostels have worst services u have very little freedom for yourself | Some faculty is very rude with students and i didnt like that
33,C. V. Raman Global University,3.8,The professor who taught in our class they are taught is best In teaching. | I like my teachers they are the best to guide us | The professor who taught in our class they are taught is best In teaching.,Odisha temperature is very bad i.e is very disappointed for me. | I don't like parking area of the college because that are is very dirty
34,Sri Krishna College of Engineering and Technology - [SKCET],4.1,"The syllabus is good, and the exposure to subjects is very good because of the faculty who provide information about them. | The internships they provide for students have been excellent. It is very useful as they provide stipends. | The syllabus is good, and the exposure to subjects is very good because of the faculty who provide information about them.","Most of the placements are from IT companies, which is detrimental for core students. | Sports are given importance here, and gender partiality is not an issue; they are treated equally"
35,Kongu Engineering College - [KEC],4.1,Kongu college is a very Beautiful campus The atmosphere was very good. | Our college is the safest and best place where we feel safe where. | Kongu college is a very Beautiful campus The atmosphere was very good.,"I disliked to Walk To Playing ground, the distance between Class to ground is 1km . | Food is only veg , but i want non veg so this the thing i disliked"
36,"Vignan's Foundation for Science, Technology, and Research",4.0,Awesome infrastructure of the college that is places in acres of land | It is very best about the Study and the campus life is very happy. | Awesome infrastructure of the college that is places in acres of land,I dislike the college timings in which all the students of the college feel bored and like a school. | They aren't providing basic package's which is worst part of this university
37,B.S. Abdur Rahman Crescent Institute of Science & Technology - [BSAU],4.2,"Our college is a very good place to build knowledge and skills. The exam structures include CAT and end-semester exams. | It is a trusted educational institution, Crescent Engineering College, located in Chennai. The college has the best infrastructure and offers stipends to students based on their marks. | Our college is a very good place to build knowledge and skills. The exam structures include CAT and end-semester exams.","About placements, this college doesnt support for placement as their reputation has decreased in recent times. Consequently, most companies do not come for campus interviews, and even if they do, they only recruit a few students. With a ratio of 1:9, it is disheartening that the placement prospects are not satisfactory. | Management provided a fee-free facility for poor students through the trust operated by the college administration."
38,Bannari Amman Institute of Technology - [BIT],4.2,The culture at the college is very good and the placements are very good | Like la 1st The infrastructure of this college is very good | The culture at the college is very good and the placements are very good,I am not comfortable with the hostel rooms that they provided.
39,Institute of Engineering and Management - [IEM],4.0,College Placement - The College Placement In IEM is The Best in Eastern india in BCA | Institute of engineering management one of the best college in Kolkata. | College Placement - The College Placement In IEM is The Best in Eastern india in BCA,"Location - The Location of The college is very Bad because i have to travel a lot to reach The College | Paying 85,000 per semester without having air-conditioned classrooms is quite disappointing."
40,Sona College of Technology,4.3,"I havent been to college. Ive attended a foundational course where the faculty were good. There were 20 girls and 40 boys. All the teachers are qualified with PHDs. | In a project team, tasks should be distributed across our software team in order to plan, track, and release high-quality output. | I havent been to college. Ive attended a foundational course where the faculty were good. There were 20 girls and 40 boys. All the teachers are qualified with PHDs.","They also offer scholarships to poor and middle-class individuals who are unable to pay the fee. | No, you have to apply at the office before you can get admission. Application forms will be given in the college offline. I received approximately 60 thousand reservation benefits."
41,Jain University - [JU],3.9,"Faculty are one of the best to say , they ll clarify your doubts at any time , there is no biased environment | Hostel life in jain University is preety awesome i would say because of the weather and environment | Faculty are one of the best to say , they ll clarify your doubts at any time , there is no biased environment","In college, sometimes wifi will not work so it will be very difficult to browse through internet because sometime network will not come in some areas. | The food of the canteen is not good very bad taste."
42,Chaitanya Bharathi Institute of Technology - [CBIT],4.1,Our college has the best placements percentage and all achieve it | In our college we have very good faculty to teach students | Our college has the best placements percentage and all achieve it,You will not have propr internet connection in campus that's the worst of all | Fee is very expensive and after that we don't get any placements
43,New Horizon College of Engineering - [NHCE],4.2,"I liked in this college is my friends they are very supportive | I liked the campus life because there is something always going on, i was part of the art club. | I liked in this college is my friends they are very supportive",Sargam I find this as overlooking and unnecessary and so irritating | There are fines if pay the fee late and if dont wear ID card
44,Veermata Jijabai Technological Institute - [VJTI],4.0,"Being admitted to VJTI college was a plus point for me, as it has one of the best faculty members who guide you in the best possible way. | It was a good learning experience to have an industry internship. For the internship, the placement rate was almost 100% at that time. The stipend was 15000/- per month. | Being admitted to VJTI college was a plus point for me, as it has one of the best faculty members who guide you in the best possible way.","Worst (some say, because of COVID-19), some companies come, and some students are placed, but mostly unsatisfactory. | The gender ratio is not good. The gender ratio is 10:2. There are fewer girls in the mechanical and computer branches."
45,"JNTUK University College of Engineering, Kakinada",3.9,Infrastructure facilities are very good it help convince to the study to travel | They postpone exams for us if we tell them we have movies to watch in theatres lol. | Infrastructure facilities are very good it help convince to the study to travel,Maintaince of washrooms is also bad this is also want to improved | I don't like the way that they used to correct the papers as the fail we write the correct answers
46,"Graphic Era University, School of Engineering and Technology - [GEU]",3.9,"The infrastructure at the university is excellent, with impressive architecture that gives you a genuine sense of being on a university campus. | Campus infrastructure: It has very beautiful and well maintained campus with modern infrastructure. | The infrastructure at the university is excellent, with impressive architecture that gives you a genuine sense of being on a university campus.","From timetables and class allocations to addressing student grievances, it's mess. | The classrooms are boring and tiring, creating an uninteresting environment where most students attend only for the sake of attendance or to pass the time."
47,K. J. Somaiya College of Engineering - [KJSCE],4.1,"Also, the best part is that feedback from all students is taken every semester, and the course is updated based on feedback. | There are plenty of internship opportunities. The best internship this year was with JP Morgan and Chase. They offered the position of Software Engineering Intern with a sensational stipend of Rs. | Also, the best part is that feedback from all students is taken every semester, and the course is updated based on feedback.","As in engineering, there is less break between two semesters; therefore, students prefer shorter duration internships. | They pay the entire fee for students who have poor financial conditions."
48,"GH Raisoni College of Engineering - [GHRCE], Nagpur",4.1,"The faculty members of college are best which provides all type of knowledge | The Annual fest ""Antaragini"" is the best annual event that takes place. | The faculty members of college are best which provides all type of knowledge",Bouncers are very annoying in our college because they don't let us stay anywhere in the college when we have off lectures. | This college has not any campus or ground where you can play that thing is very bad about this College of all the time
49,Mukesh Patel School of Technology Management and Engineering - [MPSTME],4.1,"The course structure is very good. It focuses on research as well as practical development skills. There are lab sessions and lectures every week with not-so-hectic timings, yet ensuring completion of the course on time. | Its a great accomplishment for everyone to get an internship at different companies and experience a great theme. | The course structure is very good. It focuses on research as well as practical development skills. There are lab sessions and lectures every week with not-so-hectic timings, yet ensuring completion of the course on time.","The exams happen sometimes, so it is not very frequent, and it makes us frustrated. | The placements are on the mediocre side as there are reputed companies arriving for campus placement, but the profile and package are not up to the mark or are less compared to other colleges."
