Serial No.,College Name,Rating,Pros,Cons
251,Amity University,4.0,The buildings and greenery of Amity University Gwalior is very attractive. | I like the curriculum of the course and faculties are also great | The buildings and greenery of Amity University Gwalior is very attractive.,I hate how thr students are still treated the way they were in school | Cutting out of entrance exams that emit filtering out of students.
252,GSFC University,4.0,It was structured in well mannered and they focus on practical learning.and after each semester you must pass through the internship training which is the best feature of the university.carricular is structured according to the course of well-known iits. | If the student wishes that he/she is interested in this particular company then that is allowed as well as the university also offers the lists of companies that students can undergo. | It was structured in well mannered and they focus on practical learning.and after each semester you must pass through the internship training which is the best feature of the university.carricular is structured according to the course of well-known iits.,no cons found
253,Federal Institute of Science and Technology - [FISAT],4.1,"The computer science department at FISAT is the best. The course is completed on time, and you can do your projects there with the best assistance from CS faculties. | There is no stipend, but for financially backward students, they offer free-of-cost study. The very good and important thing is that the Computer Science department is the best in FISAT. | The computer science department at FISAT is the best. The course is completed on time, and you can do your projects there with the best assistance from CS faculties.","Girls are locked in like in a jail because they have no right to leave after 5pm. | Overall, the campus is bad because it provides limited opportunities for students, and the conducted training is of low quality."
254,Galgotias College of Engineering and Technology - [GCET],3.9,The fest conducted in out college is also very great also the infrastructure Aswell | The best thing about college is there events college lifeis awesome | The fest conducted in out college is also very great also the infrastructure Aswell,Attendence of 75 is said to be compulsory is the worst thing | Girls and boys ratio in civil and mechanichal branches is very bad
255,Global Academy of Technology - [GAT],3.8,"Course selection is based on the students choice of course, and it is beneficial to seek guidance from the college teachers who guide parents and students based on the students educational profile. | They all look forward to the students who are physically good and mentally perfect. It was perfect in our college. | Course selection is based on the students choice of course, and it is beneficial to seek guidance from the college teachers who guide parents and students based on the students educational profile.","Better, but not much good because the syllabus is outdated, and the methods of teaching and conducting examinations are not good; all of them are outdated. | I can tell that internships in college are very poor when compared to placements!"
256,HKBK Group of Institutions,3.5,"Before getting admission in this college, I had heard that civil is the best branch in this college. However, after I got admission, I experienced that mechanical is the best branch in our college because it has the best faculties. | The college also provides the opportunity for internships and projects. There are many things that you will learn in the internships. | Before getting admission in this college, I had heard that civil is the best branch in this college. However, after I got admission, I experienced that mechanical is the best branch in our college because it has the best faculties.","The evaluation of the university in the VTU university is very poor, and it is a challenging situation as the evaluation is not being conducted properly. This is a significant issue. | Scholarships and loans were not necessary for my studies as I was an average student throughout my academic career and did not plan to pursue education abroad."
257,Sri Vasavi Engineering College - [SVEC],4.0,Best library and dgital library and some best teacting faculty and good labs. | The adminstration is good and there response over any problem related to the student is excellent and the faculty is very nice with students and the placements are good and infrastructure is very good and courses here is excellent | Best library and dgital library and some best teacting faculty and good labs.,I hate the buses the mangement was too bad for one day one bus they will provide | I dont like the hostel food and the taste is bad
258,Uka Tarsadia University,4.2,The iOS lab are just brilliant they are well falicited with internet | I like the classes as it is nice and very good maintained | The iOS lab are just brilliant they are well falicited with internet,They have really bad lab assistants to assist students in laboratories. | Paper factory produce a smoke which is having really bad smell
259,AKS University - [AKSU],3.6,"My experience in AK University has been very good, all the faculty here are helpful, there is no ragging here at all. | Availability of library is a very good option for learning students | My experience in AK University has been very good, all the faculty here are helpful, there is no ragging here at all.","Toilets are in bad condition here, cleanliness is not done well. | Solage canteen is in bad condition, there is no good way to eat."
260,ITM University,4.0,It's wonderful that I am living this college life with my friend. | I like the campus and the environment Of the campus it is very nice and spacious i like the food court area which there is the sitting area also for the students and facilities as well . | It's wonderful that I am living this college life with my friend.,Timing of University is too bad it's 11 to 5 . | The behavior of the mess staff is so pathetic they dont even cook the foo
261,Jagannath University,4.0,"My college was one of the colleges that had highly experienced faculty and the best laboratory infrastructure in the city. | We have an opportunity to have an internship in a gene company, TCS, to gain a lot of knowledge and experience that will enhance our journey. | My college was one of the colleges that had highly experienced faculty and the best laboratory infrastructure in the city.","There is a $500 charge for the activity, but there has been no activity funded throughout the whole year. | There is no cleanliness in the hostel and the people are not helpful and always littering around"
262,Babu Banarasi Das University - [BBDU],4.0,The faculty of BCA is concerned to give best knowledge to us. | Locate in city is ...thi is very good advantage of this University | The faculty of BCA is concerned to give best knowledge to us.,Some teachers are quite annoying they'll jst try to show off | The I think I don't like about my college is timing I am very tired after spend time from 9 am to 5 pm
263,JIS College of Engineering - [JISCE],4.2,I have a very good experience in my college Our College has a best infrastructre among all the JIS group colleges in kolkata. | Mentors are also solving the problems and my mentor is very good she is know how to handle the problems | I have a very good experience in my college Our College has a best infrastructre among all the JIS group colleges in kolkata.,College washroom are very poor and some bench are brocken in classroom. | The hostel has very poor food conditions and water conditions .
264,Rayat Bahra University,3.5,"Rayat Bahra University has a good number of teachers, and their teaching method is quite impressive. | Most of the people here get internships via the college, and those who want to take up internships on their own, that is, off-campus internships, can also get them. | Rayat Bahra University has a good number of teachers, and their teaching method is quite impressive.","No, they provide concessions to students studying under schemes like SC, ST, OBC, girl child scheme, and others"
265,Amity University,3.9,"Good campus exposure, had a very great time in the campus. | Got some great friendships for the life and made a lots of memories with them in my college days. | Good campus exposure, had a very great time in the campus.",Worst food and experience with the mess facility that has been provided. | Timing of our course is like 9-5 so that makes us too tired
266,IILM University,3.7,"The Bachelor of Design in Product Design is a professional course with a duration of 4 years and follows a semester system. | Boat, Nestle, M3M, Godrej, IBIS hotel, and many more hire students for a summer internship after completing 1 year. | The Bachelor of Design in Product Design is a professional course with a duration of 4 years and follows a semester system.","You are not allowed to keep electronics in your room; if they find them, they will take them. | They are not helpful at all, and when they do 1 out of 10 things for which they are being paid, they feel so proud."
267,Cambridge Institute of Technology - [CiTech],4.1,"Good college in bengaluru east zone, campus life is excellent, qualified faculty, good placement etc | Good facilities are there in college and encourage the every students | Good college in bengaluru east zone, campus life is excellent, qualified faculty, good placement etc",I was little bit disappointed that it is in heavy populated area | There is no much good places for food and cafeteria .
268,RC Patel Institute of Technology - [RCPIT],3.9,"Ya...its good experiencing here. Practicals are nicely taken. RCPIT is one of the best colleges in Maharashtra. It has a very well-maintained infrastructure. | College doesnt provide internships, but they approach the students for internships. They encourage students to do internships and guide them on what to do or how to approach internships, etc. Additionally, many training and placement activities are also attended in the institute, such as aptitude tests or seminars. | Ya...its good experiencing here. Practicals are nicely taken. RCPIT is one of the best colleges in Maharashtra. It has a very well-maintained infrastructure.","I think they should now look up to it and provide internships to students. Yet, they force students to get internships for themselves as three internships are mandatory for each student"
269,St. Francis Institute of Technology - [SFIT],3.7,"I am from Mechanical, and I can proudly say that the Mechanical H.O.D and all the teachers are the best. | Internships are provided without any stipend, but they offer valuable learning opportunities as field experience enhances understanding of concepts. | I am from Mechanical, and I can proudly say that the Mechanical H.O.D and all the teachers are the best.","The college does not provide internships due to the structure of the Mumbai University syllabus, which does not allow for long internships. | Certainly, the top engineering colleges are not correct. The management, driven by brothers from Church, is not open towards college improvement in terms of teaching, placements, and infrastructure. Therefore, only consider this college if you have no better options and are desperate to pursue engineering from anywhere."
270,ICFAI University,4.0,Best faculty i have ever meet.They guide like a there children. | We can play any sports and place is very nice . | Best faculty i have ever meet.They guide like a there children.,The management team of icfai are poor and they need to improve on that | And the road of Icfai that are not good I thing we they make the road
271,Atharva College of Engineering,4.0,"It was an amazing experience at Atharva College with practical labs and classrooms, which are the best among top colleges. | Officially, there is no organization that provides internships. However, you will have the opportunity to work in numerous local startups, and you can easily secure an internship with a reputable company. | It was an amazing experience at Atharva College with practical labs and classrooms, which are the best among top colleges.","The exam structure is a little boring as it comes under Mumbai University, in which everything is theoretical and there is very little practical experience. There are a total of 8 semesters, including oral and practical exams. | Sorry to say, but Atharva College promised all the students placements, yet they failed to fulfill their promise."
272,Don Bosco Institute of Technology - [DBIT],4.1,"Instructors are well-educated and well-qualified. They keep guiding in everything. The teaching method is very good. | Our college tries its best to offer internships, but if one has good contacts with a company, that works best. If you can get your own internship offer, the college will back it too. | Instructors are well-educated and well-qualified. They keep guiding in everything. The teaching method is very good.","If you are even one percentage point less than 75%, that means you are a defaulter as well as in danger."
273,GNIOT Group of Institutions - [GNIOT],3.8,"There is no issue regarding fee and our campus is very good and well maintain. | Greenery, Dress code is the best i liked about my college. | There is no issue regarding fee and our campus is very good and well maintain.","Timings are very bad as if a person is living away from home and reaching at 7pm and than he is cooking so how can a person study | College management , students are tired with there managerial decision that is very poor."
274,Jeppiaar Engineering College,3.6,"BE Mechanical is the best course in engineering to get placed upon leaving the college. Teaching faculties and everyone were good to us. | The college internship program was really good, and Bosch company offered the program and a stipend of about 7000. | BE Mechanical is the best course in engineering to get placed upon leaving the college. Teaching faculties and everyone were good to us.","Somehow, each semester is theoretical and boring, consisting of labs, theory, and problem-solving papers. The first semester is not relevant to the course itself. Mathematics is somehow difficult, and there is poor management and publication of results. | There will be fewer job opportunities in my college. Only a few companies will come for placements, and only a few students will get job opportunities. Moreover, civil students will never get job opportunities; only students from the IT field will be selected."
275,Karpagam College of Engineering - [KCE],4.0,"Yeah, overall good with the course curriculum and faculty, but the course should be in a practical manner. | The project will be owned and updated. | Yeah, overall good with the course curriculum and faculty, but the course should be in a practical manner.","The hostel is the worst. We cant stay there; it will make us feel bad. Poor toilet facilities, drainage system that does not work properly, and water problems, including unhygienic drinking water, are all issues we have to deal with, along with the inconvenience of having to go a long distance for food"
276,KIET Group of Institutions - [KIET],4.0,Clubs:-having differental department for different activities is the best part to indulge in academical activities | Even during recession the placement cell is trying its best to get everyone placed | Clubs:-having differental department for different activities is the best part to indulge in academical activities,Day scholors cannot remain in the college after 5pm this is the worst thing | The sport facility is very bad and they do not provide sports eqipment
277,PES College of Engineering - [PESCOE],3.7,"Campus life | I liked green campus, gym, swimming pool in college | I liked class rooms, hostel, clubs in college",Nothing
278,Raghu Engineering College - [REC],4.0,"Yes,internship like pega academy has been established within our campus and it is very proud to say that our college is 13 among the colleges who are having pega university academy program(UPA) in INDIA.In hostel they are providing fee wi-fi network. | In college security is excellent and the labs and playground is also excellent to play. | Yes,internship like pega academy has been established within our campus and it is very proud to say that our college is 13 among the colleges who are having pega university academy program(UPA) in INDIA.In hostel they are providing fee wi-fi network.","College Ground was too worst , the maintanence was not good | Accommodation is somewhat poor and I hope it can be improved"
279,Symbiosis Institute of Technology - [SIT],4.2,"I chose computer science because it was easier for me, but the facilities are not up to the mark. Deepak sir, who is one of the data structure professors, is very good and meets the standards. | It is very good to have an internship so that we can gain good industrial exposure. This is how they work and what exactly the industries want from their employees. | I chose computer science because it was easier for me, but the facilities are not up to the mark. Deepak sir, who is one of the data structure professors, is very good and meets the standards.","Over the course of three years, everything has broken down, and honestly, I cant wait for this torture to be over."
280,Terna Engineering College Navi Mumbai,3.7,"Terna Engineering College is one of the best engineering colleges in Navi Mumbai, which is the reason why I chose this college. | We can do an internship anywhere we want. Our college assists us in getting the best internship opportunity with minimum efforts. | Terna Engineering College is one of the best engineering colleges in Navi Mumbai, which is the reason why I chose this college.",The course is outdated because the college is still affiliated with Mumbai University. The faculty-to-student ratio is 1:80. The faculty is highly qualified but lacks in delivering knowledge to students. Passing exams is not that difficult. | The Placement Cells must work a bit harder in order to obtain a few internship opportunities for the students.
281,Vivekanand Education Society Institute of Technology - [VESIT],4.0,"The course curriculum consists of 526 objects, depending on the semester. The subjects are helpful in our on-campus placement, as they are provided by Mumbai University, which is a really great university. | VESIT does not provide internships on its own, but there are a number of societies that can help you in obtaining internships throughout your course. | The course curriculum consists of 526 objects, depending on the semester. The subjects are helpful in our on-campus placement, as they are provided by Mumbai University, which is a really great university.","Depending on the branches, for Computers/iT and Instrumentation, it is good. However, for Electronics and EXTC, the placement is unsatisfactory. | There are scholarship facilities available at the college for students who are unable to pay the fees or are in a condition where they cannot afford it."
282,Sreenidhi Institute of Science and Technology - [SNIST],3.9,"Infrastructure, fests, tournaments which are conducted in our college in very good | The interaction between student and teacher is very good in SNIST | Infrastructure, fests, tournaments which are conducted in our college in very good",I hate the college Library because we have to maintain silence . | I hate the college security because whenever the bell rangs ...
283,Paavai Engineering College (Autonomous),3.9,Symposium was good conduct and celebrate the annual day was dicipline and compare to others college our college was great because of maintained dicipline and students obedience are good and this college was good | I like the love infrastructure in my college which is very good. | Symposium was good conduct and celebrate the annual day was dicipline and compare to others college our college was great because of maintained dicipline and students obedience are good and this college was good,Bus in our college is too bad condition that when raining water comes inside bus.
284,Assam Don Bosco University - [ADBU],3.7,"I like the cafeteria area the canteen is good | The faculty of the college are good and supportive. | The environment is too good for studies, Good facilities Smart boards, projectors, AC labs",The campus experience is not so good. The campus is very short. | The campus is not so big. The auditorium stage is very small and speakers are really really bad
285,RK University - [RKU],3.8,"If you want to study computer engineering or IT engineering, then this is the best college for you. However, you may have a problem with the hostel food because I also realized how RK Universitys hostel food is! | Every student gets the best internship opportunity with a minimum stipend of 8000, or as per their skills and experience. | If you want to study computer engineering or IT engineering, then this is the best college for you. However, you may have a problem with the hostel food because I also realized how RK Universitys hostel food is!","No, they would not provide internships exactly, but instead they would help in finding companies that would offer internships. The internships usually involved knowledge transition only, and no stipends were given for them. | Yes, there were programs offered by the college for scholarships to students who are not financially strong"
286,Baddi University of Emerging Sciences and Technologies - [BUEST],3.6,"Baddi University has good teachers and professors, and all of them are professionals in their respective areas. | I have no idea about the internship because I thought there is no internship facility in the college, but the placements are good for CSE and EE students. To clarify the task, you have to put your best effort into the work. | Baddi University has good teachers and professors, and all of them are professionals in their respective areas.","The stipend was not offered at all; in fact, we have to pay for those technical courses. | During my tenure, I only had call center placements. However, I have now come to know that it is better since the college has been turned into a deemed university."
287,Sai Nath University,4.0,College provide placement for students for all the courses | College follows the rules for all the students and staff | The campus life here is very good. All the classmates are seen while studying.,These college runs like a school with a lot of rules | Whenever I enter to the college it always feels like a police station
288,GITAM,3.9,Infrastructure and the locality where the college situated is very good. | I like the environment of the college and the amenities in this college is good. | Infrastructure and the locality where the college situated is very good.,Hostel food is bad here and the hostel fecility is bad | There is no proper management if any think goes wrong to compliant.
289,Yenepoya University,3.8,The faculty who is teaching are one if the best here | Technology was very good they provide a hughe lab for programming facilities | The faculty who is teaching are one if the best here,Strict of the hostel is very bad we are considering like a child | Nit giviving scholarship for rank holders in semester they ask pre- university marks
290,DAV University,4.0,"Their method of teaching is very effective in providing us with valuable guidelines. | Agriculture students do internships in many agriculture companies, such as sugar mills, pesticides, and herbicides companies. | Their method of teaching is very effective in providing us with valuable guidelines.","Because in other colleges, proper training is also being provided besides placements, which is lacking in our college"
291,Pacific University,3.8,"The course I chose is very good, based on practical learning, and the college facilities for practicals are good. | Yes, the internship they provide will be a very good experience, I think! | The course I chose is very good, based on practical learning, and the college facilities for practicals are good.","There is no scholarship in college, and it is too expensive for the middle class, so choose accordingly"
292,ICFAI University,4.2,"The course is designed very well, keeping in mind the competitive exams such as GATE, IES, etc., as well as interview purposes. | Many firms, such as Regan Association, hire students with good packages and provide good internships for future prospects. They also provide knowledge about legal research and practice, which improves personality growth and development. | The course is designed very well, keeping in mind the competitive exams such as GATE, IES, etc., as well as interview purposes.","It was an expensive course in a tall building with no campus, and the placements were poor, and the amenities were not sufficient to make it a good post-graduate college."
293,KCG College of Technology,3.9,First thing is about the nature of the college it was good to study at that environment and enjoy with friends. | The lab session was best to experience the hand on live classes it was such a grate experience. | First thing is about the nature of the college it was good to study at that environment and enjoy with friends.,We have to compromise in hostel food which is worst sometimes | Some of the faculties are not well experienced
294,Silicon Institute of Technology - [SIT],3.9,The course is not up to the best its just like grasping only things and it should must be mofidified to achieve the best productivity. | This year our college student made 26lpa and also one of the passes out of 2020 made 45lpa which is a great package and helps the students. | The course is not up to the best its just like grasping only things and it should must be mofidified to achieve the best productivity.,It was the worst experience none company came for the internship offer and we got null as stipended.
