Serial No.,College Name,Rating,Pros,Cons
98,The National Institute of Engineering - [NIE],4.1,Clubs here are very good an there are plenty of clubs here . | It is a very good placement and faculties are very good. | Clubs here are very good an there are plenty of clubs here .,"Food here will be very bad and if you are north Indian it will nightmare for you. | The barren north campus, which gives very bad impression abt the college"
99,North Eastern Regional Institute of Science and Technology - [NERIST],3.8,"The fee structure and also the environment. | I liked the ratio of girls and boys in my college, i guess 43:57 ratio of girls and boys in my college | environment around the college is very pleasant and pure. It provide good environment to live and study",The infrastructure here is not bad but have to go way more far.
100,Velagapudi Ramakrishna Siddhartha Engineering College - [VRSEC],4.1,We have a very good faculty maximum all of them has completed their PHD | Placements are very good they provide for each and every student | We have a very good faculty maximum all of them has completed their PHD,"Infrastructure,placement disparities,administrative issues and teachers in ece branch are mainly worst. | The transport facolitg is very poor which need to be improved"
101,Dr. Mahalingam College of Engineering & Technology - [MCET],3.7,"ABT Parcel Services is a reputable company, and ABT Cars Services is also a good organization. | The stipend varies based on performance during the interview process, and generally, it will be around $5000 to $25000 per month. | ABT Parcel Services is a reputable company, and ABT Cars Services is also a good organization.","Unfortunately, I didnt have any internship experience since my studies were only for 3 years. | When it comes to core companies, mechanical and automobile students struggle to get placed."
102,Gokaraju Rangaraju Institute of Engineering and Technology - [GRIET],4.0,Environment is the best here as the college is placed on the hill. | Faculty in the college faculty in the college are very good in profession | Environment is the best here as the college is placed on the hill.,I hate the safari batch they dont allow us to use the mobile in the canteen | The security system is bad we can not roam in the campus
103,Kakatiya Institute of Technology & Science - [KITSW],4.1,The campus the greenery is very beautiful and has lot of trees | We got one of the best faculty members in our college. | The campus the greenery is very beautiful and has lot of trees,Walking all along the pathway to our block and stepping up stairs is too difficult | Play ground is bit small and equipment maintenance is not upto the mark
104,Shri Vishnu Engineering College for Women - [SVECW],4.2,"The way of study they followed they have best plan for every type of student mindset and they motivate every student based on their interests | Coming to the placements, our college is the best in providing on campus placements. | The way of study they followed they have best plan for every type of student mindset and they motivate every student based on their interests","They security is too outrageous they could give some freedom for the girls | The food sometimes, the menu sometimes is too blant, they make this pumpkin,mango,drumstick pulusu and i absolutely hate it"
105,Alliance College of Engineering and Design,3.9,Environment of college and ambience which is so calming | Department of ece and the practical labs which are ambient | I like the infrastructure of my college .,Focusing more on marks and exams than practicality | Focusing more on exams and marks than paracticality
106,Saveetha School of Engineering - [SSE],4.1,Research & Development projects.Hostels and also the canteens have the perfect food for the students | Infrastructure:the Infrastructure are very good no problem in it comparable to abrod camous | Research & Development projects.Hostels and also the canteens have the perfect food for the students,They will show their anger on poor students like an ambition | When your sick you're forced to go hospital even if you don't want to
107,Pimpri Chinchwad College of Engineering - [PCCOE],4.0,"Placement in our college are very good so I like my college | Hostels are goood,mess is also okiesh which is an good thing,sports ground are maintained well so its an good sign too | Placement in our college are very good so I like my college",Mess food is little tastes less in our so I hate it some time | I never liked the girls hostel and also the water is not good.
108,Dwarkadas J Sanghvi College of Engineering - [DJSCE],4.1,The vicinity is good located around other colleges and near two railway stations | All the students in CS and IT department have high potential. | The vicinity is good located around other colleges and near two railway stations,The fees is slightly on the higher end compared to other Maharashtra colleges
109,Fr. Conceicao Rodrigues College of Engineering - [CRCE],4.0,"The production course in this college is more practical-driven where you receive hands-on training and apply theories and concepts that you learned days ago in lectures, which is probably the best thing about this course. | For the internship, almost all good production companies near Mumbai came, like Godrej, Mahindra, Siemens, etc. | The production course in this college is more practical-driven where you receive hands-on training and apply theories and concepts that you learned days ago in lectures, which is probably the best thing about this course.","There may not be a good scholarship or loan facility offered by the college, or perhaps I havent looked into it"
110,Dr. M.G.R. Educational and Research Institute,3.8,"The course i chosen was one of the best course in my college, i chosen bio technology engineering department have separate labs for the chemical and microscopic testing. | I like the morning breakfast in hostel and lunch also awesome | The course i chosen was one of the best course in my college, i chosen bio technology engineering department have separate labs for the chemical and microscopic testing.",The parking is worst to park the vehicle in the district sun light | Campus size is too small but number of students are lot
111,Basaveshwar Engineering College - [BEC],3.8,"In this college, the Electronics department is very good and has very nice laboratories with good equipment and infrastructure. | Tata Consultancy Services (TCS), Bosch, and many more companies come to our college to provide internships for the students. | In this college, the Electronics department is very good and has very nice laboratories with good equipment and infrastructure.","Our college doesnt provide any internships. We didnt receive any stipend. However, the annual toppers will receive a stipend, but not through the internship, rather through other means. | Placements are very bad. The only company that conducted placements was Tata Consultancy Services Ltd., in which I got placed. However, it is very disappointing to say that the college and department never showed interest in the placements and job opportunities of students."
112,MKSSS's Cummins College of Engineering for Women,4.1,"The college is an autonomous institution, so the syllabus is updated regularly. We also have industrial visits that help us gain practical knowledge. The emphasis is placed on application-based learning, and internship opportunities are provided to give students valuable experience. | The teachers suggest you some names of companies and websites through which you can get internships of your own interest. | The college is an autonomous institution, so the syllabus is updated regularly. We also have industrial visits that help us gain practical knowledge. The emphasis is placed on application-based learning, and internship opportunities are provided to give students valuable experience.","The college gave a project to the students as a form of internship, in order for them to gain experience and be a part of the curriculum. | The management is not too supportive, but maybe you can get out of your problem with a little extra time."
113,Sagi Ramakrishnam Raju Engineering College - [SRKR ],4.1,Play ground and Laboratories are the best laboratories which i had known. | Canteen where we can talk with our friends and eat delicious food | Play ground and Laboratories are the best laboratories which i had known.,Gate opening timings was very worst that I had never seen in my life. | The fests was quite boring i guess because i am not the type of guy
114,Sri Sairam Institute of Technology - [SSIT],4.0,"I wanted to pursue CSE, but I was late for admission. I got BTech in IT, which is also a very good course. Both have the same syllabus. | Some companies, like Mr. Cooper, are offering good roles and are providing stipends to college students. The students must participate in projects and coding technical programs for their interviews and placements. | I wanted to pursue CSE, but I was late for admission. I got BTech in IT, which is also a very good course. Both have the same syllabus.","Mechanical engineering is the best course compared to others, but the exam structure in my college is very poor. The exams are conducted for unnecessary reasons, resulting in a complete waste of time for students. | I suppose this question is irrelevant because my college does not offer any such internship at all."
115,Vel Tech Multi Tech Dr. Rangarajan Dr. Sakunthala Engineering College,3.4,I like the infrastructure of the college it gives a pleasant feeling fell | There is a gym for student use which is a good one. | I like the infrastructure of the college it gives a pleasant feeling fell,The canteen foods are costly and not worth for the money.
116,Thakur College of Engineering and Technology - [TCET],4.0,Great opportunities for sports and show up on skills for students | According to my experience the orientation of the subjects are good. | Great opportunities for sports and show up on skills for students,They should initiate the practical learning of subject and should take care of all students | Some of students who used to create trouble to other classmates or faculty member.
117,Easwari Engineering College - [EEC],4.0,"The course structure is good. Yes, we have three days of lab sessions in our college, and we have exams every other week in a month. The lab sessions here are very good for showcasing our talent, and the lab is awesome. | Through our well-known recruiters, many students from our colleges have been placed in great firms, such as L&T, Saint Gobain, Bluescope, etc. | The course structure is good. Yes, we have three days of lab sessions in our college, and we have exams every other week in a month. The lab sessions here are very good for showcasing our talent, and the lab is awesome.","The affiliated colleges have had the same syllabus for the past 15 years, but there has been no improvement in the syllabus or in studying new technology. There is no time to learn new things because everyone is solely focused on completing the curriculum and conducting tests. | Only placements in IT companies are provided. The number of core companies visiting the college is very less, especially for the mechanical engineering department. There are no core companies."
118,Gayatri Vidya Parishad College of Engineering,3.9,"Interactive classes with faculty and students is best thing, faculty interact with students | I like how the college will do it's best to get the needs of students for scholarships. | Interactive classes with faculty and students is best thing, faculty interact with students","The washrooms in the college are cleaned, but still there is bad smell coming. | Dogs roam everywhere in the college even into the washroom which makes the student inconvenient."
119,Dr. B R Ambedkar Institute of Technology,4.1,Everything is good but the main advantage is you have a lot of free time to invest your time into your dreams | The Green environment is really great that I like the most because it gives u lots of positive energy | Peer group is really good giving u the best possible competition.,No one cares about the students academic stuff
120,Manipal University - [MUJ],4.1,Campus Life is very good you'll experience all the things in this campus | Campus life is very good at university it gives you good vibes | Campus Life is very good you'll experience all the things in this campus,It's transport facilities which is very bad and it's control on their students. | People show off too much around here which is too disgusting here
121,The LNM Institute of Information Technology - [LNMIIT],3.9,College Clubs and fests are on point they are like one of the best in north india | Coding culture is considered one of the best thing considered here | College Clubs and fests are on point they are like one of the best in north india,"College's Location is very bad, its around 15-16kms from the city | The style of teaching by faculty is very poor and not upto the mark."
122,SRM Institute of Science and Technology - [SRMIST],4.0,College fest is awesome and clubs for racing and semi conductors helped gain some level practial knowledge. | The aesthetic view of the campus will make you feel like you are at one of the best universities in India. | College fest is awesome and clubs for racing and semi conductors helped gain some level practial knowledge.,Stay hostel I feel pathetic condition comparing to amount paid anually | I don't like the professors and they behaviour is very bad.
123,Christ University,4.1,"The campus is very beautiful which creates a perfect study environment | Infrastructure is really good and improving day by day.the classroom,staff room, auditorium are well built | The campus is very beautiful which creates a perfect study environment",I hated how the faculties just used to cut our attendance for not coming and sitting in the front | I hate the library rules where u can't take textbooks of any subjects and can't use calculators
124,Manipal Academy of Higher Education - [MAHE],4.1,The food is one of the best thing in manipal they have the best menu every week | The infrastructure is very good the buildings are tall and air conditioned | best campus and library .. culture around,"Travel discomfort - I lived in a city that was out of the way, and commuting was a hectic and slightly expensive endeavour | NRI quota which is unfair for the students who came by merit"
125,Centurion University of Technology and Management - [CUTM],3.8,College environment(greenery campus) is the best things you will get in CUTM. | Our college campus is very good and it's environment was good | College environment(greenery campus) is the best things you will get in CUTM.,Hostel out facility and process is every strict as compared to other colleges | Less time for practicals and other stuffs excluding the main classes.
126,Sharda University,4.0,Faculty here are very good and helps us in every step. | Capus life quite good but not the best structure is also good but there are many internation students from africian counties . | Faculty here are very good and helps us in every step.,The management is really slow at work and will take a lot of time to act on your problems
127,SVKM's Narsee Monjee Institute of Management Studies - [NMIMS University],4.0,"Industrial exposure is being provided at a great level, but the administration does not care about the students opinions at all. | During the normal course, students can have access to much better opportunities by choosing off-campus internships. | Industrial exposure is being provided at a great level, but the administration does not care about the students opinions at all.","I dont have much idea about campus placement yet as I havent visited the campus nor do I have much interest in it, as my interest in placement is very less"
128,K.R. Mangalam University,3.7,Canteen.our canteen are impressed me by price and quality specialiy if you see this is in gurgaon side | The library is the perfect place if you ever need some lone time or want to study in peace. | Canteen.our canteen are impressed me by price and quality specialiy if you see this is in gurgaon side,The on campus wifi is literally the worst one ive seen and all the IT team has to say is we will fix it by tomorrow which never comes for them i guess. | The on campus food from canteens and CCD is really poor and overprice for what it is.
129,Galgotias University - [GU],3.7,"The very best thing about this college is infrastructure they built, faculty members. | Best thing of this college is faculty as they always promotes every student | The very best thing about this college is infrastructure they built, faculty members.",The management of the galgotias University is the worst they did not handle students | The managemet of the university is very very bad ERP of thr Galgotias University
130,Nirma University,4.0,"Campus life is awesome here, a lot of places to chill with friends are there in the campus. | Placement Campus is best to get job in product based company | Campus life is awesome here, a lot of places to chill with friends are there in the campus.",Nirma has 85% attendance criteria and so it is difficult to bunk classes | So the only thing to hate is the attendance criteria and some faculty.
131,REVA University,4.2,The swami vivekananda block which is ine of the best blocks in the capmus | The faculty is well experienced and have knowledge about the the topic. | The swami vivekananda block which is ine of the best blocks in the capmus,The crowd at Reva is too bad and you need to make way if you're getting late for class in the morning | And some staff are very rude people like i have seen them but i have listened from others.
132,Bennett University,4.3,And as we say that college life is a way to interact with people from all over the country.Overall its a wonderful experience here in the campus. | Gym is the best place to workout and to relief with stress | And as we say that college life is a way to interact with people from all over the country.Overall its a wonderful experience here in the campus.,The transportion from college to metro is the worst thing in the College. | Mess food taste :it is worst at the night i.e dinner
133,Chitkara University - [CU],4.0,Teacher at chitkara are best they help u in every aspect they help you in research and also in projects | Classroom are goods and techniques of faculty to tech student is best. | Teacher at chitkara are best they help u in every aspect they help you in research and also in projects,Food at square one is very bad according to its price | The food iw very bad and the items inside are very expensive.
134,Singhania University,3.5,"I chose this course because of my keen interest in teaching and my dream of being a good teacher so that i can serve the society. | Students get placed in one of the best companies, each student can get 2 3 jobs maximum and every one will get jobs choice. | I chose this course because of my keen interest in teaching and my dream of being a good teacher so that i can serve the society.",Should need to have more campuses in different states of india so that everyone can afford | Need to have travel facility for far away students so they can come join the college
135,Shiv Nadar University - [SNU],4.3,Faculty of the college is very good and they set good quality paper. | Campus life - Campus life is happening and it feels good to wake up every morning and looking forward to a good day ahead. | Faculty of the college is very good and they set good quality paper.,The curfew of entering the campus by 9PM is annoying at times. | Connectivity of the college is not good and cabs are also expensive.
136,Harcourt Butler Technological University - [HBTU],3.8,The auditorium is very best and have capacity of 1000 students | Fest in hbtu is very good celebrity like dharsan raval perform in the college. | The auditorium is very best and have capacity of 1000 students,"The facility is not good, their behavior and nature is so bad. | This is wrong because sometimes the book we want is unavailable in library."
137,Jaipur National University - [JNU],4.1,"College buildings and roads are very good, trees are planted everywhere. | Food of canteen is very good and the timing of canteen is good | College buildings and roads are very good, trees are planted everywhere.",They not give security money on time there office process is very bad | The canteen is bad in nature and the food quality is also bad
138,Integral University,4.1,"Ground is perfect because it helps up to play all the sports like badminton , lawn tennis, football, cricket etc . | Nature of our College is very good and also environment of our college is very good. | Ground is perfect because it helps up to play all the sports like badminton , lawn tennis, football, cricket etc .",Sometime you just got frustrated because they just don't listen some of the department | Security behaviour is not good with students they talk very badly to the students
139,Vellore Institute of Technology - [VIT],4.1,Placement Opportunities: The institution's robust placement cell and industry connections facilitate excellent placement opportunities for students. | Labs - the lab facilities provided at Vit chennai are the best and have every equipment required . | Placement Opportunities: The institution's robust placement cell and industry connections facilitate excellent placement opportunities for students.,"Accmodations and all the foodl outlets inside the campus are very expensive | Some labs are very bad, systems being slow or not working at all"
140,K L University - [KLH],4.0,"The campus college is good and surrounded by good environment no sounds and surrounded by trees | The faculty were good, however when your year increases, their teaching also decreases. | The campus college is good and surrounded by good environment no sounds and surrounded by trees",The road to the college is not good now they are constructing the road. | SPORTS: The management should have provided at least 2 classes per week for refreshment of students.
141,Manav Rachna International Institute of Research and Studies - [MRIIRS],3.9,Teachers are polite and kind hearted and they are beautiful too. | Infrasture is so nice and some teacher are also very nice. | Teachers are polite and kind hearted and they are beautiful too.,Exams happen too often giving less time for any other extra activities and upgrading skills
142,Pandit Deendayal Energy University - [PDEU],4.1,The campus placement is the best thing as you know about 80% of the students get campus placement here. | The library system are awesome within a minute i can find books. | The campus placement is the best thing as you know about 80% of the students get campus placement here.,"Exams are quite tough here but depends upon how to study. | Sometimes, the schedule is very tight for student, having 9-6 class"
143,Alliance University,4.0,"The course curriculum was well-defined, and it increased the anxiety level by making us think about the best way to be persuaded by Alliance University. | The university offers good internship opportunities depending on the specialization one has chosen. | The course curriculum was well-defined, and it increased the anxiety level by making us think about the best way to be persuaded by Alliance University.","The syllabus is not according to the current state of gate. It contains subjects which are very impractical in nature. Overall, the course structure is very bad. | The starting package was 3 lakhs, which was a very small package for a b.tech student. After investing 7-8 lakhs, the return was not 50% of it."
144,"Pandit Deendayal Energy University, School of Technology - [PDEU SOT]",4.2,"The course curriculum is the best and is of great help as it prepares students for industries and markets. | Also, there are lots of startups in incubation, so there is no problem with internships. Many research internships are also provided by the college itself. | The course curriculum is the best and is of great help as it prepares students for industries and markets.",Some faculties are so rude. They don't get liberal with students. | Attendance is very important in my college. College is very serious about attendance.
145,Amity University,4.1,Faculty are very experienced and they treat us like their child | The campus is very beautiful to sit and ador in peace. | Faculty are very experienced and they treat us like their child,"AND ACS ARE ALWAYS BE TURNES ON, THERE IS TOO COLD | Pattern making labs have broken tiles which sometimes hurt one's legs"
146,VIT Bhopal University,3.9,"I would say out of the four campuses of VIT, VIT Bhopal has the best coding environment. | If a student does well in their academics, they provide the best opportunities | I would say out of the four campuses of VIT, VIT Bhopal has the best coding environment.",The response time of dws of our college is also very bad | The chief warden wouldnt permit you to go out if you have a bad impression in front of him; he is the biggest fool in the world.
147,Acharya Institute of Technology - [AIT],4.1,"And my Hod , one of the best and talented person I've seen. | Faculty is very friendly and give us a very good knowledge | And my Hod , one of the best and talented person I've seen.",No hostel inside the campus which is the worst thing for a hosteller
